country,publish_date,url,title,tests,ventilators,beds,ppe
China,,https://www.aljazeera.com/news/2020/04/china-support-coronavirus-hit-europe-stirs-controversy-200404160742616.html,Why China's support to coronavirus-hit Europe stirs controversy,,"['16,000 ventilators']",,
China,04-06-2020 00:00,http://www.tribune242.com/news/2020/apr/06/china-donates-1000-covid-19-testing-kits/,"China donates 1,000 COVID-19 testing kits","['1,000 test kits']",,,
China,04-04-2020 20:48,https://www.ocregister.com/china-to-ny-ventilator-shipment-shows-coronavirus-supply-scramble,China-to-NY ventilator shipment shows coronavirus supply scramble,,['140 ventilators'],,
China,04-07-2020 00:00,https://www.thestar.com.my/news/nation/2020/04/07/28-icu-beds-flown-in-from-china-rushed-to-hospitals,28 ICU beds flown in from China rushed to hospitals,,,"['100 ICU beds', '28 ICU beds', '72 ICU beds']",
China,,https://www.thehindu.com/news/national/coronavirus-outbreak-170-lakh-chinese-ppes-to-ease-shortage/article31273465.ece,"Coronavirus outbreak | Tamil Nadu, Maharashtra to get PPE’s donated by China",,,,"['3,87,473 PPE']"
China,04-06-2020 15:31,https://theprint.in/india/india-receives-1-7-lakh-ppe-coveralls-from-china-to-fight-covid-19/396616/,India receives 1.7 lakh PPE coveralls from China to fight Covid-19,,,,"['3,87,473 PPE']"
China,04-06-2020 21:09,https://www.washingtonexaminer.com/news/china-makes-italy-buy-back-its-personal-protective-gear-during-coronavirus-pandemic-report,China makes Italy buy back its personal protective gear during coronavirus pandemic: Report,,"['16,000 ventilators']",,
India,04-06-2020 16:37,https://www.reuters.com/article/us-health-coronavirus-southasia/testing-times-for-india-in-race-to-head-off-coronavirus-epidemic-idUSKBN21O11A,Testing times for India in race to head off coronavirus epidemic,"['35,875 tests', '96,000 tests', '100,000 tests']",,,
India,,https://www.channelnewsasia.com/news/asia/india-in-race-to-head-off-covid-19-coronavirus-epidemic-12614516,Testing times for India in race to head off COVID-19 epidemic,"['35,875 tests', '90,000 tests']",,,
India,,https://swarajyamag.com/insta/india-has-ordered-5-lakh-more-coronavirus-testing-kits-25-lakh-to-arrive-by-9-april-icmr,"India Has Ordered 5 Lakh More Coronavirus Testing Kits, 2.5 Lakh To Arrive by 9 April: ICMR","['13,000 tests']",,,
India,04-06-2020 00:00,https://www.thejakartapost.com/news/2020/04/06/odd-number-in-india-coronavirus-testing-data-sparks-questions.html,Odd number in India coronavirus testing data sparks questions,"['96,000 tests']",,,
India,,https://www.businesstoday.in/current/economy-politics/coronavirus-is-india-testing-enough-people-for-coronavirus/story/400235.html,Coronavirus: Is India testing enough people for coronavirus?,"['1,30,000 tests', '93 tests']",,,
India,04-01-2020 00:00,https://www.theguardian.com/world/2020/apr/01/india-coronavirus-cases-rise-amid-fears-true-figure-much-higher,India coronavirus cases rise amid fears true figure much higher,"['47,951 tests']",,,
India,,https://www.bbc.com/news/world-asia-india-52106565,Coronavirus: India's race to build a low-cost ventilator to save Covid-19 patients,,"['48,000 ventilators', '30,000 ventilators']",,
India,,https://www.aljazeera.com/news/2020/04/india-toaster-sized-ventilator-fight-virus-200402090302355.html,India's toaster-sized ventilator to help in fight against virus,,"['40,000 ventilators']",,
India,,https://www.moneycontrol.com/news/business/companies/coronavirus-pandemic-this-is-how-india-is-trying-to-overcome-ventilator-shortage-5095201.html,Coronavirus pandemic: This is how India is trying to overcome ventilator shortage,,"['1,000 ventilators', '19 ventilators', '50,000 ventilators', '220,000 ventilators']",,
India,,http://www.jamaicaobserver.com/news/toaster-size-ventilator-from-india-helps-hospitals-in-virus-fight_191441?profile=1373,Toaster-size ventilator from India helps hospitals in virus fight,,"['40,000 ventilators']",,
India,03-24-2020 00:00,https://www.brookings.edu/blog/up-front/2020/03/24/is-indias-health-infrastructure-equipped-to-handle-an-epidemic/,COVID-19 | Is India’s health infrastructure equipped to handle an epidemic?,,"['220,000 ventilators', '25,556 ventilators']","['57,119 ICU beds']",
India,,https://www.businesstoday.in/top-story/covid-19-cases-rise-to-107-india-faces-shortage-of-ventilators-icu-beds/story/398269.html,"COVID-19 cases rise to 107; India faces shortage of ventilators, ICU beds",,,"['70,000 ICU beds']",
India,,https://timesofindia.indiatimes.com/india/coronavirus-does-india-have-enough-ventilators-hospital-beds/articleshow/74822427.cms,"Coronavirus: Does India have enough ventilators, hospital beds?",,"['25,556 ventilators']","['57,119 ICU beds']",
India,04-07-2020 07:10,https://www.hindustantimes.com/india-news/china-donates-170-000-ppe-kits-to-india-to-help-fight-covid-19/story-QjqZ3U21OXmzol1L3koAiN.html,"China donates 170,000 PPE kits to India to help fight Covid-19",,,,"['387,000 PPE', '20,000 PPE']"
India,04-06-2020 15:31,https://theprint.in/india/india-receives-1-7-lakh-ppe-coveralls-from-china-to-fight-covid-19/396616/,India receives 1.7 lakh PPE coveralls from China to fight Covid-19,,,,"['3,87,473 PPE']"
India,,https://qz.com/india/1829905/the-iits-are-stepping-up-to-help-india-battle-coronavirus/,The IITs are stepping up to help India battle coronavirus,,"['50,000 ventilators']",,"['100,000 N95 masks']"
Indonesia,04-06-2020 18:23,https://www.straitstimes.com/asia/se-asia/indonesia-ranks-among-worlds-worst-in-coronavirus-testing-rate-together-with-ethiopia,"Indonesia ranks among world's worst in coronavirus testing rate, together with Ethiopia, Bangladesh",['16 tests'],,,
Indonesia,04-02-2020 12:25,https://www.reuters.com/article/us-health-coronavirus-indonesia-governor/indonesia-needs-massive-rapid-testing-for-coronavirus-idUSKBN21K1OI,"Indonesia needs 'massive, rapid' testing for coronavirus","['7,193 tests']",,,
Indonesia,04-07-2020 05:00,https://www.straitstimes.com/asia/se-asia/indonesia-testing-just-36-per-million-people,Coronavirus: Indonesia testing just 36 per million people,['16 tests'],,,
Indonesia,03-26-2020 06:20,https://www.reuters.com/article/us-health-coronavirus-indonesia-response/indonesias-health-system-on-the-brink-as-coronavirus-surge-looms-idUSKBN21C0J6,Indonesia's health system on the brink as coronavirus surge looms,,,"['321,544 hospital beds']",
Indonesia,,https://www.firstpost.com/health/coronavirus-outbreak-amid-rising-covid-19-cases-indonesia-sees-deficit-in-hospital-beds-medical-staff-icu-55-dead-so-far-8189201.html,"Coronavirus Outbreak: Amid rising COVID-19 cases, Indonesia sees deficit in hospital beds, medical staff, ICU; 55 dead so far",,,"['321,544 hospital beds']",
Indonesia,03-26-2020 00:00,https://www.theguardian.com/global-development/2020/mar/26/indonesia-could-have-thousands-of-hidden-coronavirus-cases-study-says,Indonesia’s hidden coronavirus cases threaten to overwhelm hospitals,,,"['321,544 hospital beds']",
Indonesia,04-01-2020 10:04,https://www.reuters.com/article/us-health-coronavirus-indonesia-hospital/indonesia-set-to-open-emergency-coronavirus-hospital-on-uninhabited-island-idUSKBN21J52B,Indonesia set to open emergency coronavirus hospital on uninhabited island,,,['12 hospital beds'],
Pakistan,04-06-2020 15:35,https://www.arabnews.com/node/1654206/world,Pakistan braced for double blow of coronavirus outbreak,"['1,000 test kits']",,,
Pakistan,03-31-2020 18:28,https://gulfnews.com/world/asia/pakistan/covid-19-pakistan-rapidly-setting-up-new-labs-buying-ventilators-testing-kits-1.70729066,"COVID-19: Pakistan rapidly setting up new labs, buying ventilators, testing kits",,"['1,000 ventilators', '2200 ventilators', '3000 ventilators', '10 ventilators', '16 ventilators']",,"['30 surgical masks', '16,700 PPE', '100,000 PPE', '100,000 Personal Protective Equipment']"
Pakistan,04-06-2020 15:35,https://www.arabnews.com/node/1654206/world,Pakistan braced for double blow of coronavirus outbreak,"['1,000 test kits']",,,
Pakistan,03-31-2020 23:44,https://nation.com.pk/31-Mar-2020/pakistan-needs-artificial-intelligence-to-beat-covid-19,Pakistan needs Artificial Intelligence to beat COVID 19,,"['1300 ventilators', '10,000 ventilators', '2000 ventilators', '150 ventilators']",,
Pakistan,03-31-2020 18:28,https://gulfnews.com/world/asia/pakistan/covid-19-pakistan-rapidly-setting-up-new-labs-buying-ventilators-testing-kits-1.70729066,"COVID-19: Pakistan rapidly setting up new labs, buying ventilators, testing kits",,"['1,000 ventilators', '2200 ventilators', '3000 ventilators', '10 ventilators', '16 ventilators']",,"['30 surgical masks', '16,700 PPE', '100,000 PPE', '100,000 Personal Protective Equipment']"
Pakistan,03-31-2020 00:00,https://www.brecorder.com/2020/03/31/585242/pakistani-ai-company-develops-portable-ventilator-to-combat-covid-19/,Pakistani AI company develops portable ventilator to combat COVID-19,,['1000 ventilators'],,
Pakistan,,https://www.thenews.com.pk/print/630435-coronavirus-pakistan-much-deficient-in-machines-designed-to-provide-mechanical-ventilation,Coronavirus: Pakistan much deficient in machines designed to provide mechanical ventilation,,"['250 ventilators', '1,300 ventilators', '140 ventilators', '475 ventilators', '150 ventilators']",,
Pakistan,,https://www.voanews.com/science-health/coronavirus-outbreak/pakistan-railway-converts-train-cars-covid-19-isolation-units,Pakistan Railway Converts Train Cars Into COVID-19 Isolation Units,,,"['2,000 hospital beds']",
Pakistan,03-24-2020 13:42,https://nationalinterest.org/feature/coronavirus-and-pakistan-why-people-must-immediately-begin-social-distancing-136697,The Coronavirus and Pakistan: Why People Must Immediately Begin Social Distancing,,"['1,700 ventilators']",,
Pakistan,,https://www.aljazeera.com/news/2020/03/pakistan-daily-wagers-struggle-survive-coronavirus-lockdown-200325115143152.html,Pakistan daily wagers struggle to survive in coronavirus lockdown,,,"['119,000 hospital beds']",
United States,02-28-2020 17:45,https://www.sciencemag.org/news/2020/02/united-states-badly-bungled-coronavirus-testing-things-may-soon-improve,The United States badly bungled coronavirus testing—but things may soon improve,['459 tests'],,,
Indonesia,03-26-2020 06:20,https://www.reuters.com/article/us-health-coronavirus-indonesia-response/indonesias-health-system-on-the-brink-as-coronavirus-surge-looms-idUSKBN21C0J6,Indonesia's health system on the brink as coronavirus surge looms,,,"['321,544 hospital beds']",
Brazil,04-04-2020 00:00,https://www.theguardian.com/global-development/2020/apr/04/medics-in-brazil-fear-official-coronavirus-tally-ignores-a-mountain-of-deaths,Brazil coronavirus: medics fear official tally ignores ‘a mountain of deaths’,"['54,000 tests']",,,
Brazil,03-20-2020 00:00,https://www.contractpharma.com/contents/view_breaking-news/2020-03-20/eurofins-expands-covid-19-testing-in-europe-and-brazil/,Eurofins Expands COVID-19 Testing in Europe and Brazil,"['10,000 tests', '15,000 tests']",,,
Brazil,,https://abcnews.go.com/International/wireStory/brazil-lacks-coronavirus-tests-equipment-report-69979839,"Brazil lacks coronavirus tests, other equipment, report says","['50,000 tests']",,,
Brazil,,https://time.com/5816243/brazil-jair-bolsonaro-coronavirus-governors/,Brazil's President Still Insists the Coronavirus Is Overblown. These Governors Are Fighting Back,,,['21 ICU beds'],
Brazil,,https://www.dw.com/en/brazil-amazons-indigenous-tribes-brace-for-coronavirus/a-53042209,Brazil: Amazon's indigenous tribes brace for coronavirus,,,['20 hospital beds'],
Nigeria,,https://qz.com/africa/1824401/coronavirus-nigerias-cdc-has-conducted-only-153-tests/,The troubling data point behind Nigeria’s low number of coronavirus cases,"['15,500 tests', '10,000 tests']",['500 ventilators'],,
Nigeria,,https://www.itnewsafrica.com/2020/04/covid-19-news-tech-companies-work-to-solve-the-ventilator-shortage-in-nigeria/,COVID-19 News: Tech Companies Work to Solve the Ventilator Shortage in Nigeria,,['100 ventilators'],"['56,320 ICU beds']",
Nigeria,03-30-2020 12:46,https://www.premiumtimesng.com/news/headlines/384840-coronavirus-nigeria-has-350-icu-beds-for-200-million-people.html,Coronavirus: Nigeria has 350 ICU beds for 200 million people,,"['500 ventilators', '8,000 ventilators', '100,000 ventilators']","['20 ICU beds', '350 ICU beds']",
Nigeria,04-06-2020 10:45,https://www.pulse.ng/news/local/coronavirus-chinese-billionaire-jack-ma-donates-ventilators-ppes-to-nigeria-others/983kb09,"Coronavirus: Chinese billionaire Jack Ma donates ventilators, PPEs to Nigeria, others","['20,000 test kits']",['500 ventilators'],,
Bangladesh,,https://www.weforum.org/agenda/2020/04/in-bangladesh-covid-19-could-cause-a-humanitarian-crisis/,Why Bangladesh is especially vulnerable to the coronavirus,,,['432 ICU beds'],
Bangladesh,03-30-2020 16:22,https://www.atlanticcouncil.org/blogs/new-atlanticist/defusing-bangladeshs-covid-19-timebomb/,Defusing Bangladesh’s COVID-19 time bomb,"['1,185 tests']",,,"['15,000 surgical masks']"
Bangladesh,04-06-2020 18:23,https://www.straitstimes.com/asia/se-asia/indonesia-ranks-among-worlds-worst-in-coronavirus-testing-rate-together-with-ethiopia,"Indonesia ranks among world's worst in coronavirus testing rate, together with Ethiopia, Bangladesh",['16 tests'],,,
Bangladesh,04-03-2020 00:00,https://www.dhakatribune.com/bangladesh/2020/04/03/bangladesh-expands-covid-19-testing,Bangladesh expands Covid-19 testing,['513 tests'],,,"['3,66,350 personal protective equipment']"
Bangladesh,,https://www.benarnews.org/english/news/bengali/ventilator-shortage-04062020150700.html,"Bangladesh Faces Stark Shortage of Ventilators to Fight COVID-19, NGO Says",,"['1,475 ventilators', '1,500 ventilators', '30 ventilators', '300 ventilators']",,
Bangladesh,,https://www.weforum.org/agenda/2020/04/in-bangladesh-covid-19-could-cause-a-humanitarian-crisis/,Why Bangladesh is especially vulnerable to the coronavirus,,,['432 ICU beds'],
Bangladesh,04-06-2020 00:00,https://www.dhakatribune.com/health/coronavirus/2020/04/06/coronavirus-is-bangladesh-following-its-national-plan,Coronavirus: Is Bangladesh following its national plan?,,,"['34 ICU beds', '1,169 ICU beds']",
Bangladesh,03-30-2020 16:22,https://www.atlanticcouncil.org/blogs/new-atlanticist/defusing-bangladeshs-covid-19-timebomb/,Defusing Bangladesh’s COVID-19 time bomb,"['1,185 tests']",,,"['15,000 surgical masks']"
Russia,03-26-2020 10:35,https://www.sciencemag.org/news/2020/03/new-coronavirus-finally-slamming-russia-country-ready,The new coronavirus is finally slamming Russia. Is the country ready?,"['700,000 test kits', '193,000 tests']",,,
Russia,03-18-2020 00:00,https://foreignpolicy.com/2020/03/18/fortress-russia-coronavirus-spread-covid-pandemic/,Fortress Russia Begins to Show Cracks as Coronavirus Spreads,"['116,000 tests']",,,
Russia,03-21-2020 00:00,https://meduza.io/en/feature/2020/03/21/the-ventilator-problem,The ventilator problem Russia has way more machines that can keep coronavirus patients breathing than Italy did — but that doesn’t mean the pandemic will be any easier. — Meduza,,"['5,000 ventilators', '8,175 ventilators', '62,000 ventilators', '40,000 ventilators']",,
Russia,04-06-2020 00:00,https://www.vox.com/2020/4/6/21200167/coronavirus-russia-vladimir-putin-moscow-cases,"Russia’s growing coronavirus outbreak and its challenge to Vladimir Putin, explained",['19 tests'],"['40,000 ventilators']","['70,000 hospital beds']",
Russia,03-21-2020 00:00,https://meduza.io/en/feature/2020/03/21/the-ventilator-problem,The ventilator problem Russia has way more machines that can keep coronavirus patients breathing than Italy did — but that doesn’t mean the pandemic will be any easier. — Meduza,,"['5,000 ventilators', '8,175 ventilators', '62,000 ventilators', '40,000 ventilators']",,
Russia,03-20-2020 00:00,https://www.nytimes.com/2020/03/20/world/europe/russia-coronavirus-covid-19.html,"Thanks to Sanctions, Russia Is Cushioned From Virus’s Economic Shocks","['100,000 test kits']",,,
Mexico,03-30-2020 00:00,https://www.washingtonpost.com/world/the_americas/coronavirus-mexico-us-border-covid-19/2020/03/30/18ad79b2-7061-11ea-a156-0048b62cdb51_story.html,Coronavirus on the border: Why Mexico has so few cases compared with the U.S.,['65 tests'],,,
Mexico,03-19-2020 19:42,https://slate.com/news-and-politics/2020/03/mexico-is-frighteningly-unprepared-for-the-coronavirus.html,Mexico Is Frighteningly Unprepared for the Coronavirus,,,"['150 hospital beds', '3,000 ICU beds', '340 hospital beds']",
Mexico,04-03-2020 00:00,https://www.sandiegouniontribune.com/news/border-baja-california/story/2020-04-03/hecho-en-mexico-the-ventilator-that-could-save-your-life,Hecho en Mexico: the ventilator that may save your life,,"['1,500 ventilators']",,
Mexico,04-01-2020 20:41,https://www.reuters.com/article/us-health-coronavirus-mexico-ventilators/mexico-scrambles-to-meet-desperate-u-s-european-ventilator-demand-idUSKBN21J6PV,"Mexico scrambles to meet desperate U.S., European ventilator demand",,"['30,000 ventilators']",,
Mexico,03-19-2020 19:42,https://slate.com/news-and-politics/2020/03/mexico-is-frighteningly-unprepared-for-the-coronavirus.html,Mexico Is Frighteningly Unprepared for the Coronavirus,,,"['150 hospital beds', '3,000 ICU beds', '340 hospital beds']",
Mexico,04-06-2020 19:25,https://finance.yahoo.com/news/coronavirus-killing-lopez-obrador-big-192551656.html,Coronavirus Is Killing Lopez Obrador’s Big Plans for Mexico,,"['10,000 ventilators']",,
Japan,04-06-2020 11:32,https://www.reuters.com/article/us-health-coronavirus-japan-hospitals-in/running-out-of-beds-and-gear-tokyo-medical-staff-say-japans-state-of-emergency-already-here-idUSKBN21O0K4,"Running out of beds and gear, Tokyo medical staff say Japan's 'state of emergency' already here","['443,273 tests']",,,
Japan,03-18-2020 12:08,https://www.reuters.com/article/us-health-coronavirus-japan-testing/japan-uses-just-a-fraction-of-its-coronavirus-testing-capacity-idUSKBN2150ZR,Japan uses just a fraction of its coronavirus testing capacity,"['200,000 tests', '32,000 tests']",,,
Japan,03-16-2020 06:06,https://www.reuters.com/article/us-health-coronavirus-japan-challenges/in-nagoya-scramble-for-hospital-beds-shows-coronavirus-challenge-for-aging-japan-idUSKBN2130JR,"In Nagoya, scramble for hospital beds shows coronavirus challenge for aging Japan",,"['3,000 respirators']",,
Japan,03-17-2020 00:00,https://www.japantimes.co.jp/news/2020/03/17/national/science-health/nagoya-hospital-beds-coronavirus-aging-japan/,"In Nagoya, scramble for hospital beds highlights coronavirus challenge for aging Japan",,"['3,000 respirators']",,
Japan,04-06-2020 11:32,https://www.reuters.com/article/us-health-coronavirus-japan-hospitals-in/running-out-of-beds-and-gear-tokyo-medical-staff-say-japans-state-of-emergency-already-here-idUSKBN21O0K4,"Running out of beds and gear, Tokyo medical staff say Japan's 'state of emergency' already here","['443,273 tests']",,,
Japan,,https://www.nasdaq.com/articles/japan-animal-ventilator-maker-looks-to-boost-output-for-human-coronavirus-patients-2020-04,Japan animal ventilator maker looks to boost output for human coronavirus patients,,"['8,000 ventilators']",,
Japan,04-06-2020 11:32,https://www.reuters.com/article/us-health-coronavirus-japan-hospitals-in/running-out-of-beds-and-gear-tokyo-medical-staff-say-japans-state-of-emergency-already-here-idUSKBN21O0K4,"Running out of beds and gear, Tokyo medical staff say Japan's 'state of emergency' already here","['443,273 tests']",,,
Ethiopia,04-05-2020 15:40,https://news.yahoo.com/ethiopia-reports-first-coronavirus-death-154040908.html,Ethiopia reports first coronavirus death,"['1,222 tests', '647 tests', '500 tests']",,,
Ethiopia,04-06-2020 00:00,https://www.thejakartapost.com/news/2020/04/06/ethiopia-reports-first-two-deaths-from-coronavirus.html,Ethiopia reports first two deaths from coronavirus,"['1,222 tests', '647 tests', '500 tests']",,,
Ethiopia,04-06-2020 00:00,https://www.africanews.com/2020/04/06/ethiopia-s-coronavirus-rules-crowd-ban-free-transport-regulate-essentials-etc/,"Ethiopia coronavirus: major Addis market to relocate, 2 deaths as cases reach 44","['15,000 tests', '900 tests', '500 tests']","['1,500 ventilators', '54 ventilators']",,
Ethiopia,04-06-2020 18:23,https://www.straitstimes.com/asia/se-asia/indonesia-ranks-among-worlds-worst-in-coronavirus-testing-rate-together-with-ethiopia,"Indonesia ranks among world's worst in coronavirus testing rate, together with Ethiopia, Bangladesh",['16 tests'],,,
Ethiopia,04-03-2020 09:32,https://news.yahoo.com/ethiopia-races-bolster-ventilator-stockpile-coronavirus-fight-093246283.html,Ethiopia races to bolster ventilator stockpile for coronavirus fight,,"['200 ventilators', '1,000 ventilators', '1,500 ventilators', '54 ventilators']",,
Ethiopia,04-04-2020 00:00,https://www.africanews.com/2020/04/04/africa-s-ventilator-dystopia-ethiopia-trains-doctors-on-covid-19-lifesavers/,"Africa's ventilator dystopia, Ethiopia trains doctors on COVID-19 lifesavers",,"['200 ventilators', '1,000 ventilators', '54 respirators']",,
Ethiopia,04-06-2020 00:00,https://www.africanews.com/2020/04/06/ethiopia-s-coronavirus-rules-crowd-ban-free-transport-regulate-essentials-etc/,"Ethiopia coronavirus: major Addis market to relocate, 2 deaths as cases reach 44","['15,000 tests', '900 tests', '500 tests']","['1,500 ventilators', '54 ventilators']",,
Ethiopia,04-03-2020 00:00,https://www.africanews.com/2020/04/03/ethiopia-s-coronavirus-rules-crowd-ban-free-transport-regulate-essentials-etc/,"Ethiopia coronavirus: major Addis market to relocate, 2 deaths as cases reach 44","['15,000 tests', '900 tests', '500 tests']","['1,500 ventilators', '54 ventilators']",,
Philippines,03-31-2020 12:17,https://www.reuters.com/article/us-health-coronavirus-philippines-cases/philippines-sees-largest-daily-rise-in-coronavirus-deaths-cases-idUSKBN21I12V,"Philippines sees largest daily rise in coronavirus deaths, cases","['15,000 tests']",,,
Philippines,04-06-2020 00:00,https://www.sentinelandenterprise.com/2020/04/06/the-latest-lockdown-in-philippines-extended-to-april-30/,The Latest: Lockdown in Philippines extended to April 30,,,,"['368,000 N95 masks']"
Philippines,03-24-2020 00:00,https://www.npr.org/sections/coronavirus-live-updates/2020/03/24/820906636/concerns-in-philippines-after-duterte-given-emergency-powers-to-fight-covid-19-s,Concerns In Philippines After Duterte Given Emergency Powers To Fight COVID-19 Spread,"['100,000 test kits', '3,000 tests']",,,
Philippines,04-04-2020 11:04,https://gulfnews.com/world/asia/philippines/coronavirus-philippines-locally-developed-26-test-kit-approved-1.1585984887075,Coronavirus: Philippines' locally-developed $26 test kit approved,"['26,000 tests', '120,000 tests']",,,
Philippines,04-06-2020 00:00,https://www.sentinelandenterprise.com/2020/04/06/the-latest-lockdown-in-philippines-extended-to-april-30/,The Latest: Lockdown in Philippines extended to April 30,,,,"['368,000 N95 masks']"
Philippines,04-03-2020 00:36,http://outbreaknewstoday.com/philippines-covid-19-cases-rise-doh-tells-health-workers-ppe-is-on-the-way-20918/,"Philippines: COVID-19 cases rise, DOH tells health workers, ‘PPE is on the way’",,,,"['15,000 PPE']"
Philippines,04-06-2020 00:00,https://wbng.com/2020/04/06/the-latest-south-korea-health-minister-urges-vigilance/,The Latest: Lockdown in Philippines extended to April 30,,,,"['368,000 N95 masks']"
Egypt,04-06-2020 00:00,https://egyptianstreets.com/2020/04/06/protect-provide-and-progress-egypts-international-response-in-the-covid-19-fight/,"Protect, Provide, and Progress: Egypt’s International Response in the COVID-19 Fight","['200,000 tests']",['400 ventilators'],['1000 ICU beds'],
Japan,04-06-2020 03:37,https://www.reuters.com/article/us-health-coronavirus-japan-ventilators/japan-animal-ventilator-maker-looks-to-boostoutput-for-human-coronavirus-patients-idUSKBN21O097,Japan animal ventilator maker looks to boost output for human coronavirus patients,,"['8,000 ventilators']",,
Vietnam,,https://e.vnexpress.net/news/news/vietnam-imports-200-000-rapid-test-kits-for-large-scale-covid-19-testing-4077074.html,"Vietnam imports 200,000 rapid test kits for large-scale Covid-19 testing",['19 tests'],,,
Vietnam,04-03-2020 12:23,https://www.reuters.com/article/health-coronavirus-vietnam-vingroup/update-1-vietnams-vingroup-says-to-produce-ventilators-in-covid-19-fight-idUSL4N2BR2ON,UPDATE 2-Vietnam's Vingroup says to produce ventilators in COVID-19 fight,,['560 ventilators'],,
Germany,04-03-2020 00:00,https://www.cnbc.com/2020/04/03/germany-has-a-low-coronavirus-mortality-rate-heres-why.html,Germany has a low coronavirus mortality rate: Here's why,"['500,000 tests']",,,
Germany,04-02-2020 00:00,https://www.theguardian.com/world/2020/apr/02/germany-told-it-needs-to-massively-increase-coronavirus-testing,Germany told it needs to massively increase coronavirus testing,"['200,000 tests', '500,000 tests']",,,
Germany,,https://time.com/5812555/germany-coronavirus-deaths/,Why Is Germany's Coronavirus Death Rate So Low?,"['160,000 tests']",,,
Germany,04-05-2020 00:00,https://www.theguardian.com/world/2020/apr/05/germanys-devolved-logic-is-helping-it-win-the-coronavirus-race,Germany's devolved logic is helping it win the coronavirus race,"['500,000 tests']",,,
Germany,04-02-2020 00:00,https://www.businessinsider.com/why-germany-has-a-low-covid-19-mortality-rate-2020-4,Germany has remarkably few COVID-19 deaths. Its healthcare system shows how Germany prevented a runaway death toll.,"['160,000 tests']",,,
Germany,03-13-2020 20:03,https://www.reuters.com/article/us-health-coronavirus-draegerwerk-ventil/germany-italy-rush-to-buy-life-saving-ventilators-as-manufacturers-warn-of-shortages-idUSKBN210362,"Germany, Italy rush to buy life-saving ventilators as manufacturers warn of shortages",,"['5,000 ventilators', '10,000 ventilators', '15,000 ventilators']",,
