country,publish_date,url,title,tests,ventilators,beds,ppe
Syria,04-02-2020 00:00,https://www.washingtonpost.com/politics/2020/04/02/syrias-civil-war-will-make-fighting-coronavirus-particularly-difficult/,How will Syria handle covid-19?,"['2,000 tests', '300 test kits']","['500 respirators', '11 ventilators']",,
Syria,,https://www.middleeasteye.net/news/coronavirus-who-syria-testing-start-days-idlib,Coronavirus: WHO says testing to start within days in Syria's Idlib,"['2,000 tests']",,,"['10,000 surgical masks']"
Syria,,https://reliefweb.int/report/syrian-arab-republic/covid-19-preparedness-and-response-northwest-syria-situation-report-1,COVID-19 preparedness and response for Northwest Syria - Situation Report as of 1 April 2020 - Syrian Arab Republic,"['5,000 tests']",['90 ventilators'],,
Syria,03-20-2020 00:00,https://www.npr.org/sections/coronavirus-live-updates/2020/03/20/818847099/the-challenges-of-preparing-for-coronavirus-in-syria,The Challenges Of Preparing For Coronavirus In Syria,['103 tests'],,['200 ICU beds'],"['10,000 surgical masks']"
Syria,,https://www.aljazeera.com/news/2020/03/war-torn-syria-braces-lockdown-virus-case-200323145356045.html,War-torn Syria braces for lockdown after first virus case,"['2,000 tests']",,,"['10,000 surgical masks']"
Syria,03-23-2020 22:25,https://www.reuters.com/article/us-health-coronavirus-syria/shattered-by-years-of-war-syria-braces-for-coronavirus-spread-idUSKBN21A39M,"Shattered by years of war, Syria braces for coronavirus spread",['300 test kits'],['175 ventilators'],,
Syria,04-06-2020 05:21,https://www.al-monitor.com/pulse/originals/2020/04/coronavirus-concerns-pause-aid-work-northeast-syria.html,"Amid coronavirus concerns, some US-funded aid work paused in northeast Syria",,['11 ventilators'],,
Syria,03-20-2020 00:00,https://www.npr.org/sections/coronavirus-live-updates/2020/03/20/818847099/the-challenges-of-preparing-for-coronavirus-in-syria,The Challenges Of Preparing For Coronavirus In Syria,['103 tests'],,['200 ICU beds'],"['10,000 surgical masks']"
Syria,,https://www.aljazeera.com/news/2020/03/war-torn-syria-braces-lockdown-virus-case-200323145356045.html,War-torn Syria braces for lockdown after first virus case,"['2,000 tests']",,,"['10,000 surgical masks']"
Syria,03-20-2020 00:00,https://www.npr.org/sections/coronavirus-live-updates/2020/03/20/818847099/the-challenges-of-preparing-for-coronavirus-in-syria,The Challenges Of Preparing For Coronavirus In Syria,['103 tests'],,['200 ICU beds'],"['10,000 surgical masks']"
Syria,,https://www.plenglish.com/index.php?o=rn&id=54318&SEO=syria-applies-own-treatment-to-fight-covid-19,Syria applies own treatment to fight Covid-19,,,"['25,000 hospital beds']",
Syria,03-26-2020 00:00,https://www.cnn.com/2020/03/26/middleeast/syria-idlib-coronavirus-intl/index.html,"Rebel-held Syria braces for coronavirus 'tsunami' -- without soap, running water or the prospect of social distancing",['300 tests'],,['200 ICU beds'],
Syria,03-28-2020 00:00,https://www.euronews.com/2020/03/28/at-least-100-000-could-die-from-covid-19-in-syria-warn-ngos,"At least 100,000 could die from COVID-19 in Syria, warn NGOs",['900 tests'],,['105 ICU beds'],
Syria,,https://reliefweb.int/report/syrian-arab-republic/covid-19-preparedness-and-response-northwest-syria-situation-report-1,COVID-19 preparedness and response for Northwest Syria - Situation Report as of 1 April 2020 - Syrian Arab Republic,"['5,000 tests']",['90 ventilators'],,
Senegal,,https://www.aljazeera.com/news/2020/03/senegal-10-minute-coronavirus-test-1-200327053901231.html,Senegal: 10-minute coronavirus test may be on its way - for $1,"['1,000 test kits']",,,
Zimbabwe,04-07-2020 10:03,https://allafrica.com/stories/202004070408.html,Zimbabwe: What Goes On Inside Zimbabwe's Only Approved COVID-19 Testing Laboratory,['19 tests'],,,
Zimbabwe,04-03-2020 00:00,https://www.africanews.com/2020/04/03/coronavirus-hub-impact-of-outbreak-across-africa/,"Coronavirus: Zimbabwe beer ban U-turn, AU leaders meet, Cameroon tally booms","['20,000 tests', '9,315 tests', '30,000 tests']",,,
Zimbabwe,03-26-2020 00:00,https://www.africanews.com/2020/03/26/coronavirus-hub-impact-of-outbreak-across-africa/,"Coronavirus: Zimbabwe beer ban U-turn, AU leaders meet, Cameroon tally booms","['20,000 tests', '9,315 tests', '30,000 tests']",,,
Zimbabwe,04-01-2020 07:47,https://allafrica.com/stories/202004010191.html,"Zimbabwe: Over 15,000 Zim Returnees Dodge COVID-19 Testing",['200 tests'],,,
Zimbabwe,,https://abcnews.go.com/International/wireStory/zimbabwe-win-coronavirus-win-starvation-69868090,"In Zimbabwe, 'you win coronavirus or you win starvation'",,['20 ventilators'],,
Zimbabwe,04-06-2020 00:00,https://www.zimlive.com/2020/04/06/masiyiwa-to-donate-45-ventilators-to-zimbabwe-in-coronavirus-fight/,Masiyiwa to donate 45 ventilators to Zimbabwe in coronavirus fight,,['45 ventilators'],,
Guinea,03-30-2020 00:00,https://www.theguardian.com/world/2020/mar/30/papua-new-guinea-is-not-prepared-4000-nurses-to-strike-over-covid-19-readiness,"'Papua New Guinea is not prepared': 4,000 nurses to strike over Covid-19 readiness","['200 tests', '700 tests']",,,
Guinea,03-30-2020 00:00,https://www.theguardian.com/world/2020/mar/30/papua-new-guinea-is-not-prepared-4000-nurses-to-strike-over-covid-19-readiness,"'Papua New Guinea is not prepared': 4,000 nurses to strike over Covid-19 readiness","['200 tests', '700 tests']",,,
Belgium,04-05-2020 11:32,https://www.brusselstimes.com/all-news/belgium-all-news/104789/coronavirus-belgium-reaches-19961-confirmed-cases/,"Coronavirus: 19,691 confirmed cases in Belgium",,,"['5,735 hospital beds']",
Cuba,,https://www.miamiherald.com/news/nation-world/world/americas/cuba/article241115931.html,Cuba reports first three cases of coronavirus,,,"['3,000 hospital beds']",
Haiti,,https://www.miamiherald.com/news/nation-world/world/americas/haiti/article241797766.html,"With its first COVID-19 death, Haiti to get rapid testing","['1,000 tests', '200 tests', '257 tests', '800 tests']",,,
Haiti,04-07-2020 00:00,https://www.bet.com/news/global/2020/04/07/rapid-testing-coronavirus-haiti.html,"Organization To Do Rapid Coronavirus Testing In Haiti, Despite Controversy",['200 tests'],,,
Haiti,,https://www.miamiherald.com/news/nation-world/world/americas/haiti/article241754611.html,COVID-19 risks collapsing Haiti’s fragile health system,"['4,000 tests']",,,
Haiti,03-30-2020 00:00,https://thegrayzone.com/2020/03/30/haiti-disaster-coronavirus-us/,Haiti on the precipice as coronavirus and US-imposed leadership take their toll,,['64 ventilators'],['130 ICU beds'],
Haiti,04-03-2020 00:00,https://consortiumnews.com/2020/04/03/covid-19-haiti-on-precipice-as-virus-and-us-imposed-leadership-take-their-toll/,COVID-19: Haiti on Precipice as Virus and US-Imposed Leadership Take Their Toll,,['64 ventilators'],['130 ICU beds'],
Haiti,04-01-2020 00:00,https://www.counterpunch.org/2020/04/01/covid-19-in-haiti-the-current-response-and-challenges/,COVID-19 in Haiti: the Current Response and Challenges,['58 tests'],['64 ventilators'],['124 ICU beds'],
Haiti,03-30-2020 00:00,https://thegrayzone.com/2020/03/30/haiti-disaster-coronavirus-us/,Haiti on the precipice as coronavirus and US-imposed leadership take their toll,,['64 ventilators'],['130 ICU beds'],
Haiti,,https://www.miamiherald.com/news/nation-world/world/americas/haiti/article241797766.html,"With its first COVID-19 death, Haiti to get rapid testing","['1,000 tests', '200 tests', '257 tests', '800 tests']",,,
Portugal,,https://www.themayor.eu/en/porto-opens-first-coronavirus-drive-thru-testing-centre-in-portugal,Porto opens first coronavirus drive-thru testing centre in Portugal,['400 tests'],,,
Portugal,04-07-2020 00:00,http://www.xinhuanet.com/english/2020-04/07/c_138952457.htm,China will continue its support to Portugal in fighting COVID-19: ambassador - Xinhua,,['100 ventilators'],,"['632,000 medical masks', '135,000 N95 masks']"
Portugal,03-24-2020 17:06,https://www.explica.co/cristiano-ronaldo-and-jorge-mendes-finance-35-icu-places-to-fight-the-coronavirus-in-portugal/,Cristiano Ronaldo and Jorge Mendes finance 35 ICU places to fight the coronavirus in Portugal,,,"['10 ICU beds', '15 ICU beds']",
Azerbaijan,,https://menafn.com/1099982319/President-Ilham-Aliyev-All-measures-taken-in-Azerbaijan-so-far-have-produced-desired-effect,President Ilham Aliyev: All measures taken in Azerbaijan so far have produced desired effect,"['45,000 tests']",,,
Sweden,03-16-2020 20:46,https://www.reuters.com/article/us-health-coronavirus-getinge-ventilator/swedens-getinge-to-deliver-500-ventilators-to-italy-as-demand-rockets-idUSKBN2133NL,Sweden's Getinge to deliver 500 ventilators to Italy as demand rockets,,"['5,000 ventilators', '500 ventilators']",,
Belarus,04-07-2020 09:02,https://eng.belta.by/society/view/belarus-has-over-20000-coronavirus-testing-kits-129571-2020/,"Belarus has over 20,000 coronavirus testing kits",['700 tests'],,,
Belarus,04-06-2020 11:53,https://eng.belta.by/society/view/russia-donates-10000-coronavirus-testing-kits-to-belarus-129544-2020/,"Russia donates 10,000 coronavirus testing kits to Belarus","['10,000 tests']",,,
Belarus,04-07-2020 16:28,https://eng.belta.by/society/view/over-7000-hospital-beds-for-coronavirus-patients-in-belarus-129593-2020/,"Over 7,000 hospital beds for coronavirus patients in Belarus",,,"['7,000 hospital beds']",
Papua New Guinea,03-30-2020 00:00,https://www.theguardian.com/world/2020/mar/30/papua-new-guinea-is-not-prepared-4000-nurses-to-strike-over-covid-19-readiness,"'Papua New Guinea is not prepared': 4,000 nurses to strike over Covid-19 readiness","['200 tests', '700 tests']",,,
Papua New Guinea,03-30-2020 00:00,https://www.theguardian.com/world/2020/mar/30/papua-new-guinea-is-not-prepared-4000-nurses-to-strike-over-covid-19-readiness,"'Papua New Guinea is not prepared': 4,000 nurses to strike over Covid-19 readiness","['200 tests', '700 tests']",,,
Serbia,,https://tass.com/world/1140913,"Serbia’s coronavirus death toll rises to 58, 2,200 infections reported",['292 tests'],,,
Switzerland,04-01-2020 00:00,https://www.nytimes.com/reuters/2020/04/01/world/europe/01reuters-health-coronavirus-swiss-tests.html,Switzerland Past Bottleneck in Coronavirus Testing: Government,"['16,000 tests']",,,
Switzerland,04-07-2020 09:59,https://www.swissinfo.ch/eng/coronavirus-crisis-_has-switzerland-got-enough-hospital-beds--/45671704,Has Switzerland got enough hospital beds?,,['900 ventilators'],,
Israel,03-20-2020 00:00,https://www.middleeastmonitor.com/20200320-where-did-israels-mossad-get-100000-coronavirus-testing-kits-from/,"Where did Israel’s Mossad get 100,000 coronavirus testing kits from?","['100,000 test kits']",,,
Israel,,https://www.haaretz.com/israel-news/.premium-coronavirus-testing-rate-in-israel-to-remain-low-during-passover-1.8749057,Coronavirus Testing Rate in Israel to Remain Low During Passover,"['10,000 tests', '8,500 tests']",,,
Israel,,https://www.haaretz.com/israel-news/.premium-israel-to-make-reagents-after-sharp-drop-in-coronavirus-testing-rate-1.8743062,"Israel to Locally Produce Compound for Coronavirus Screening, After Drop in Testing Rate","['7,000 tests', '10,000 tests', '103,703 tests', '30,000 tests']",,,
Israel,,https://www.haaretz.com/israel-news/.premium-coronavirus-in-israel-fewer-tests-done-as-supplies-run-short-1.8740385,"Israel Slashes Coronavirus Tests as Supply From Germany, South Korea Runs Short","['10,000 tests', '30,000 tests']",,,
Israel,04-06-2020 00:00,https://www.algemeiner.com/2020/04/06/a-100-kilometer-commute-to-save-israels-aging-ventilator-machines/,A 100-Kilometer Commute to Save Israel’s Aging Ventilator Machines,,"['2,000 ventilators', '26 ventilators']",,
Israel,,https://www.jpost.com/israel-news/when-it-comes-to-coronavirus-could-israel-be-italy-622955,Coronavirus: The truth about Israel's ventilators,,"['30 ventilators', '2,864 ventilators', '11,000 ventilators', '56 ventilators', '114 ventilators', '191 ventilators', '3,000 ventilators']",,
Israel,,https://www.jpost.com/israel-news/coronavirus-rothschild-foundation-donates-nis-50m-to-israel-hospitals-623858,Coronavirus: Rothschild Foundation donates NIS 50m. to Israeli hospitals,,,['150 ICU beds'],
Israel,,https://www.jpost.com/Israel-News/Coronavirus-Rothschild-Foundation-donates-NIS-50m-to-Israel-hospitals-623858,Coronavirus: Rothschild Foundation donates NIS 50m. to Israeli hospitals,,,['150 ICU beds'],
Israel,,https://time.com/5814944/gaza-covid19-israel-palestinians/,Israel's Blockade Has Kept the Worst of the Coronavirus Out of Gaza. It Might Keep Aid Out Too,,['100 ventilators'],['120 ICU beds'],
Israel,04-01-2020 00:00,https://www.usnews.com/news/world/articles/2020-04-01/the-latest-experts-say-virus-could-kill-up-to-240-000-in-us,The Latest: Israel's Health Minister Has New Coronavirus,,"['1,000 ventilators', '10,000 ventilators']",,
Sierra Leone,03-31-2020 00:00,http://www.rfi.fr/en/international/20200331-no-lockdown-yet-as-sierra-leone-records-first-case-of-covid-19,No lockdown yet as Sierra Leone records first case of Covid-19,"['100 tests', '40 tests']",,,
Sierra Leone,03-20-2020 00:00,http://www.rfi.fr/en/international/20200320-sierra-leone-braces-as-coronavirus-spreads-through-west-africa-ebola-outbreak-covid-19-julius-maada-bio,Sierra Leone braces as coronavirus spreads through West Africa,['40 tests'],['95 respirators'],,"['1,000 surgical masks']"
Hong Kong,04-06-2020 00:00,https://week.com/2020/04/06/the-latest-south-korea-health-minister-urges-vigilance/,The Latest: Hong Kong to remain closed to foreigners,,,,"['368,000 N95 masks']"
Laos,,https://www.phnompenhpost.com/international/laos-getting-more-medical-supplies-covid-19-fight,Laos getting more medical supplies for Covid-19 fight,,,,"['6,000 N95 masks', '13,200 surgical masks']"
Bulgaria,,https://seenews.com/news/bulgaria-to-start-mass-covid-19-testing-orders-600000-pcr-400000-rapid-tests-692790,"Bulgaria to start mass COVID-19 testing, orders 600,000 PCR, 400,000 rapid tests",,['50 ventilators'],,
Lebanon,03-31-2020 19:49,https://www.arabnews.com/node/1650706/middle-east,Lebanon’s coronavirus crisis spurs race to tackle looming ventilator shortage,,['600 ventilators'],,
Lebanon,,https://www.unicef.org/press-releases/unicef-providing-supplies-and-technical-support-fight-covid-19-lebanon,UNICEF is providing supplies and technical support to fight COVID-19 in Lebanon,,['95 respirators'],,"['830,000 surgical masks']"
Lebanon,04-07-2020 00:00,https://www.middleeastmonitor.com/20200407-unicef-delivers-supplies-to-lebanons-coronavirus-response/,UNICEF delivers supplies to Lebanon’s coronavirus response,,,,"['830,000 surgical masks']"
Nicaragua,04-02-2020 00:48,https://havanatimes.org/opinion/nicaragua-needs-massive-testing-for-covid-19/,Nicaragua Needs Massive Testing for COVID-19,['200 tests'],,,
Nicaragua,04-07-2020 14:12,https://havanatimes.org/interviews/nicaragua-ortega-will-pay-the-bill-for-the-negligence-with-covid-19/,Nicaragua: Ortega “Will Pay the Bill” for the Negligence with Covid-19,"['100,000 tests', '19 tests']",,,
Nicaragua,04-07-2020 15:28,https://todaynicaragua.com/response-of-the-sandinista-regime-to-the-coronavirus-is-the-most-erratic-says-british-medical-journal/,TODAY NICARAGUANicaragua News and AnalysisResponse of the Sandinista regime to the coronavirus is the “most erratic” says British medical journal,,['160 ventilators'],,
Nicaragua,03-13-2020 16:52,https://havanatimes.org/features/nicaragua-and-coronavirus-government-silence-weakens-protection/,Nicaragua and Coronavirus: Government Silence Weakens Protection,,['79 ventilators'],['451 hospital beds'],
Kyrgyzstan,,https://eurasianet.org/kyrgyzstan-reports-first-coronavirus-linked-death,Kyrgyzstan reports first coronavirus-linked death,,['550 ventilators'],,
Kyrgyzstan,,https://eurasianet.org/kyrgyzstan-reports-first-coronavirus-linked-death,Kyrgyzstan reports first coronavirus-linked death,,['550 ventilators'],,
Turkmenistan,,https://www.9and10news.com/i/the-latest-turkmenistan-bans-use-of-word-coronavirus/,The Latest: Turkmenistan bans use of word ‘coronavirus’,,"['2,000 ventilators', '30 ventilators', '1,000 ventilators']",,
Singapore,03-31-2020 00:00,http://www.marketwatch.com/story/what-we-can-learn-from-south-korea-and-singapores-efforts-to-stop-coronavirus-in-addition-to-wearing-face-masks-2020-03-31,What we can learn from South Korea and Singapore’s efforts to stop coronavirus (besides wearing face masks),"['100,000 test kits']",,,
Singapore,,https://www.msn.com/en-us/money/companies/singapores-richest-man-gains-dollar35-billion-with-ventilators/ar-BB125tB9,Singapore’s Richest Man Gains $3.5 Billion With Ventilators,,"['3,000 ventilators']",,
Finland,,https://yle.fi/uutiset/osasto/news/thl_coronavirus_testing_in_finland_nearly_doubles_in_under_a_week/11293208,THL: Coronavirus testing in Finland nearly doubles in under a week,"['1,200 tests', '30,000 tests']",,,
Slovakia,03-26-2020 00:00,https://www.usnews.com/news/world/articles/2020-03-26/slovakias-new-government-to-sharply-ramp-up-coronavirus-testing,Slovakia's New Government to Sharply Ramp up Coronavirus Testing,"['4,751 tests']",,,
Norway,04-05-2020 00:00,https://www.telegraph.co.uk/news/2020/04/05/coronavirus-did-norway-manage-test-many-people/,Coronavirus: How did Norway manage to test so many people?,"['2,250 tests']",,,
Norway,03-31-2020 16:10,https://www.reuters.com/article/health-coronavirus-norway-pm/update-1-norway-pm-sees-positive-early-signs-in-fight-against-coronavirus-idUSL8N2BO6D9,UPDATE 1-Norway PM sees positive early signs in fight against coronavirus,,"['1,000 respirators']",,
Costa Rica,03-21-2020 00:00,https://ticotimes.net/2020/03/21/costa-rica-adds-just-four-more-known-coronavirus-cases-up-to-117-nationwide,Costa Rica adds just four more known coronavirus cases; up to 117 nationwide,['150 tests'],,,
Liberia,04-06-2020 00:09,https://frontpageafricaonline.com/letter-to-the-editor/liberias-government-covid-19-testing-have-been-flawed/,Liberia’s Government COVID-19 Testing Have Been Flawed,"['20,000 test kits']",,,
Liberia,03-25-2020 20:56,https://www.sahanjournal.com/immigration/report-from-the-front-lines-a-nursing-assistant-from-liberia-describes-what-its-like-to-work-in-healthcare-in-minnesota-during-the-covid-19-pandemic/,Report from the front lines: A nursing assistant from Liberia describes working during the COVID-19 pandemic,,,,['95 medical masks']
Ireland,,https://www.thejournal.ie/ireland-coronavirus-testing-5068982-Apr2020/,"Covid-19: Ireland is still way short of its testing targets, but where do we rank globally?","['8,663 tests', '3,199 tests', '42,484 tests', '6,165 tests', '12,271 tests', '15,000 tests', '213,181 tests']",,,
Ireland,,https://www.irishtimes.com/news/health/coronavirus-ireland-s-infection-peak-has-passed-but-death-toll-could-hit-400-by-may-report-says-1.4223259,"Coronavirus: Ireland’s infection peak has passed, but death toll could hit 400 by May, report says",,['125 ventilators'],"['88 ICU beds', '250 ICU beds']",
New Zealand,04-08-2020 00:00,https://www.theguardian.com/world/2020/apr/08/ardern-optimistic-as-new-zealand-records-lowest-number-of-covid-19-cases-for-two-weeks,Ardern optimistic as New Zealand records lowest number of Covid-19 cases for two weeks,"['4,098 tests']",,,
New Zealand,03-20-2020 00:00,https://www.theguardian.com/world/2020/mar/20/new-zealand-sees-biggest-daily-surge-in-coronavirus-cases-as-testing-increases,New Zealand sees biggest daily surge in coronavirus cases as testing increases,['524 tests'],,,
New Zealand,04-06-2020 00:00,https://www.wsws.org/en/articles/2020/04/06/mari-a06.html,New Zealand school at centre of escalating COVID-19 outbreak,"['40,000 tests', '500 tests']",,,
Croatia,,https://www.total-croatia-news.com/news/42661-covid-19-testing-in-croatia,How Does Amount of COVID-19 Testing in Croatia Compare Globally?,"['5,355 tests', '10,874 tests']",,,
Croatia,,https://www.total-croatia-news.com/editorial/42617-croatia-covid-19,"Croatia COVID-19 Health, Travel & Stats Live Updates April 7, 2020","['82 tests', '36 tests', '10847 tests', '11 tests', '298 tests', '118 tests', '74 tests']",,,
Croatia,,https://www.croatiaweek.com/latest-croatia-confirms-39-new-covid-19-cases-on-thursday/,LATEST: Croatia confirms 39 new COVID-19 cases on Thursday,['566 tests'],,,
Croatia,,https://www.total-croatia-news.com/editorial/42617-croatia-covid-19,"Croatia COVID-19 Health, Travel & Stats Live Updates April 7, 2020","['82 tests', '36 tests', '10847 tests', '11 tests', '298 tests', '118 tests', '74 tests']",,,
Georgia,04-06-2020 10:49,https://www.11alive.com/article/news/health/coronavirus/coronavirus-georgia-live-updates-on-april-6/85-7c6fbf89-c1a0-4b96-9e80-5a3c04f99103,Coronavirus in Georgia on April 6,"['2,497 tests', '1,000 tests', '28,777 tests']",,,
Georgia,,https://www.ajc.com/news/breaking-news/breaking-georgia-reports-more-coronavirus-deaths-cases-reach-818/5zgV6PrEkYAqTXLegJvpmJ/,TOP LOCAL STORY: 19 new coronavirus deaths brings Georgia’s toll near 350; cases top 9K,"['33,800 tests']",,,
Georgia,,https://www.ajc.com/news/local-govt--politics/georgia-playing-catch-coronavirus-testing/gl4wnmEeV9TAe4X3Lopk3O/,Georgia playing catch up in coronavirus testing,"['20,326 tests']",,,
Georgia,04-06-2020 00:00,https://www.news4jax.com/news/georgia/2020/04/06/first-2-covid-19-cases-reported-in-brantley-county-as-georgias-caseload-tops-7300/,"First 3 COVID-19 cases in Brantley County among more than 7,500 in Georgia","['1,000 tests', '31,274 tests']",,,
Georgia,04-06-2020 11:35,https://patch.com/georgia/atlanta/drive-thru-coronavirus-testing-site-set-georgia-tech,Drive-Thru Coronavirus Testing Site Set Up At Georgia Tech,"['1,000 tests']",,,
Georgia,04-07-2020 00:00,https://www.news4jax.com/news/georgia/2020/04/07/brantley-county-covid-19-death-among-329-total-reported-in-georgia/,"Brantley, Pierce County COVID-19 deaths among 348 total reported in Georgia","['1,000 tests', '33,785 tests']",,,
Georgia,,https://www.ajc.com/news/state--regional/georgia-doctors-plan-for-wrenching-choices-amid-slim-ventilator-supply/wQsxpHBZ4NADgosPKG182N/,Georgia doctors plan for wrenching choices amid slim ventilator supply,,"['20,000 ventilators']",,
Georgia,,https://www.fox5atlanta.com/news/georgia-adding-hospital-beds-medical-staffing-to-prepare-for-coronavirus-surge,"Georgia adding hospital beds, medical staffing to prepare for coronavirus surge",,,['300 hospital beds'],
Georgia,,https://www.motherjones.com/politics/2020/04/georgia-was-getting-the-hang-of-social-distancing-then-the-governors-shelter-in-place-came-along/,Georgia Was Getting the Hang of Social Distancing. Then the Governor’s Shelter-in-Place Came Along.,,,['14 ICU beds'],
Georgia,04-07-2020 19:30,https://www.washingtonexaminer.com/politics/ihme-model-now-forecasts-earlier-covid-19-peak-more-deaths-in-georgia,"IHME model now forecasts earlier COVID-19 peak, more deaths in Georgia",,,['643 ICU beds'],
Armenia,04-07-2020 00:00,https://en.armradio.am/2020/04/07/armenia-reports-20-new-cases-of-coronavirus-25-recover/,"Armenia reports 20 new cases of coronavirus, 25 recover – Public Radio of Armenia",,,"['1,400 hospital beds']",
Puerto Rico,,https://www.miamiherald.com/news/nation-world/world/americas/article241798951.html,Puerto Rico cancels order for 1 million COVID-19 tests,"['7,000 tests', '4,951 tests']",,,
Puerto Rico,,https://www.miamiherald.com/news/nation-world/world/americas/article241824361.html,A 40-year-old man becomes Puerto Rico’s youngest coronavirus victim,['968 tests'],,,
Puerto Rico,,https://www.miamiherald.com/news/nation-world/world/americas/article241675641.html,Puerto Rico says feds have approved use of coronavirus test kits,"['2,594 tests']",['500 ventilators'],,
Puerto Rico,03-13-2020 00:00,https://www.bostonglobe.com/2020/03/13/opinion/puerto-rico-must-act-now-stop-coronavirus/,Puerto Rico must act now to stop the coronavirus,['19 test kits'],,,
Puerto Rico,,http://www.coha.org/puerto-rico-and-covid-19-a-precarious-healthcare-system-faces-serious-challenges/,Puerto Rico and COVID-19: A Precarious Healthcare System Faces Serious Challenges,,,"['6,000 hospital beds']",
Albania,04-06-2020 21:10,https://www.reuters.com/article/health-coronavirus-albania/albanias-coronavirus-cases-drop-but-fears-grow-for-time-bomb-town-idUSL8N2BU711,Albania's coronavirus cases drop but fears grow for 'time-bomb' town,"['2,571 tests']",,,
Albania,04-07-2020 00:00,https://exit.al/en/2020/04/07/government-and-opposition-clash-over-coronavirus-testing-in-albania/,Government and Opposition Clash over Coronavirus Testing in Albania,"['37,000 tests', '30,000 tests']",,,
Albania,04-07-2020 00:00,https://exit.al/en/2020/04/07/albanian-government-asks-for-nato-aid-in-medical-supplies/,Albanian Government Asks for NATO Aid in Medical Supplies,,['800 ventilators'],,
Lithuania,,https://www.baltictimes.com/lithuania_waits_for_coronavirus_reagent_shipment_amid_supply_disruptions/,Lithuania waits for coronavirus reagent shipment amid supply disruptions,"['48 tests', '210 tests', '4,000 tests']",,,
Namibia,04-07-2020 06:43,https://allafrica.com/stories/202004070128.html,Namibia: PDM Calls for Widespread COVID-19 Testing,['19 test kits'],,,
Namibia,04-07-2020 06:43,https://allafrica.com/stories/202004070128.html,Namibia: PDM Calls for Widespread COVID-19 Testing,['19 test kits'],,,
North Macedonia,,https://www.nato.int/cps/en/natohq/news_174964.htm,Coronavirus response: Secretary General welcomes Allies’ support for North Macedonia,,,,"['100,000 surgical masks']"
Slovenia,,https://www.total-slovenia-news.com/politics/5973-covid-19-slovenia,"COVID-19 & Slovenia, Afternoon 2 April: Numbers, Drive-in Testing in Koper, 3D Masks, Hospital Director Resigns","['24,857 tests', '1,095 tests']",,,
Slovenia,,https://www.total-slovenia-news.com/politics/6008-covid-19-slovenia,"COVID-19 & Slovenia, Night 7 April: Numbers, PPE, Ease of Lockdown","['29,455 tests', '489 tests']",,,
